RoleID,RoleName,DutyName,,,,
PROJPROJECTSUPERVISOR,Project supervisor,Inquire into project invoices,,,,
PROJPROJECTSUPERVISOR,Project supervisor,Inquire into project master,,,,
PROJPROJECTSUPERVISOR,Project supervisor,Inquire into project timesheet delegates,,,,
PROJPROJECTSUPERVISOR,Project supervisor,Maintain project timesheet delegates,,,,
PROJPROJECTSUPERVISOR,Project supervisor,Review project transactions,,,,
PROJPROJECTSUPERVISOR,Project supervisor,Inquire into project transaction status,,,,
PROJPROJECTSUPERVISOR,Project supervisor,Enhanced preview for released products,,,,
PROJPROJECTSUPERVISOR,Project supervisor,Run, or schedule, the exporting CFDI job.,,
PROJPROJECTSUPERVISOR,Project supervisor,Manage eInvoice CFDI journals,,,,
PROJPROJECTSUPERVISOR,Project supervisor,ProjSubContractPurchaseOrdersView,,,,
PROJPROJECTSUPERVISOR,Project supervisor,View cost and project revenue profiles,,,,
PROJPROJECTSUPERVISOR,Project supervisor,View WIP project list page,,,,
PROJPROJECTSUPERVISOR,Project supervisor,Inquire into project default dimension rules,,,,
PROJPROJECTSUPERVISOR,Project supervisor,Inquire into Project Operations workspace troubleshooting details,,,,
PROJPROJECTSUPERVISOR,Project supervisor,ProjProjectManagementWorkspaceInquire,,,,
PROJPROJECTSUPERVISOR,Project supervisor,Maintain projects related optimization advisor rules,,,,
PROJTIMESHEETUSER,Project timesheet user,Maintain project timesheets,,,,
PROJTIMESHEETUSER,Project timesheet user,Enhanced preview for released products,,,,
PROJTIMESHEETUSER,Project timesheet user,TSTimesheetMyTimesheetsEnable,,,,
PROJTIMESHEETUSER,Project timesheet user,ProjTimesheetDelegate,,,,
PROJTIMESHEETUSER,Project timesheet user,Maintain mobile timesheets,,,,
REQPRODUCTIONPLANNER,Production planner,Inquire into inventory case progress,,,,
REQPRODUCTIONPLANNER,Production planner,Inquire into production case progress,,,,
REQPRODUCTIONPLANNER,Production planner,Inquire into product change cases,,,,
REQPRODUCTIONPLANNER,Production planner,Maintain demand forecasts,,,,
REQPRODUCTIONPLANNER,Production planner,Maintain forecasts,,,,
REQPRODUCTIONPLANNER,Production planner,Maintain forecast planning,,,,
REQPRODUCTIONPLANNER,Production planner,Maintain supply forecasts,,,,
REQPRODUCTIONPLANNER,Production planner,Inquire into intercompany planning policies,,,,
REQPRODUCTIONPLANNER,Production planner,Inquire into manufacturing execution progress,,,,
REQPRODUCTIONPLANNER,Production planner,Inquire into materials kanban progress,,,,
REQPRODUCTIONPLANNER,Production planner,Inquire into production kanban progress,,,,
REQPRODUCTIONPLANNER,Production planner,Inquire into sales events kanban progress,,,,
REQPRODUCTIONPLANNER,Production planner,Maintain kanban rules master,,,,
REQPRODUCTIONPLANNER,Production planner,Maintain kanban schedule,,,,
REQPRODUCTIONPLANNER,Production planner,Inquire into production flow master,,,,
REQPRODUCTIONPLANNER,Production planner,Inquire into production orders,,,,
REQPRODUCTIONPLANNER,Production planner,Maintains production scheduling,,,,
REQPRODUCTIONPLANNER,Production planner,Maintain generation of baseline demand forecasts,,,,
REQPRODUCTIONPLANNER,Production planner,Maintain authorization of adjusted demand forecasts,,,,
REQPRODUCTIONPLANNER,Production planner,Review performance of demand forecasting process,,,,
REQPRODUCTIONPLANNER,Production planner,Maintain the master for demand forecasting parameters,,,,
REQPRODUCTIONPLANNER,Production planner,Maintain master scheduling,,,,
REQPRODUCTIONPLANNER,Production planner,Maintain firming of planned orders,,,,
REQPRODUCTIONPLANNER,Production planner,Maintain planned orders,,,,
REQPRODUCTIONPLANNER,Production planner,Maintain safety stock levels,,,,
REQPRODUCTIONPLANNER,Production planner,Inquire into sales order progress,,,,
REQPRODUCTIONPLANNER,Production planner,Inquire into resource capacity,,,,
REQPRODUCTIONPLANNER,Production planner,View maximum quantity to report as finished,,,,
REQPRODUCTIONPLANNER,Production planner,Enhanced preview for released products,,,,
REQPRODUCTIONPLANNER,Production planner,Maintain intercompany master planning,,,,
REQPRODUCTIONPLANNER,Production planner,Inquire into BOM master,,,,
REQPRODUCTIONPLANNER,Production planner,Inquire into route master,,,,
REQPRODUCTIONPLANNER,Production planner,View intercompany master planning demand,,,,
REQPRODUCTIONPLANNER,Production planner,Delete kanbans,,,,
REQPRODUCTIONPLANNER,Production planner,Grants access to view and maintain the Exclude Specific Transactions data entity.,,,,
REQPRODUCTIONPLANNER,Production planner,Grants access to the forms and controls related to the setup of the Planning Optimization,,,,
REQPRODUCTIONPLANNER,Production planner,Maintain multisource policy assignments,,,,
REQPRODUCTIONPLANNER,Production planner,Maintain multisource policies,,,,
REQPRODUCTIONPLANNER,Production planner,Maintain multisource order quantity per vendor,,,,
REQPRODUCTIONPLANNER,Production planner,Maintain multisource policy assignments details,,,,
REQPRODUCTIONPLANNER,Production planner,Maintain multisource policy details,,,,
REQPRODUCTIONPLANNER,Production planner,Maintain multisource policy entries details,,,,
REQPRODUCTIONPLANNER,Production planner,Maintain multisource vendor order quantity details,,,,
REQPRODUCTIONPLANNER,Production planner,Grants access to opportunities, actions and impact within the relevant workspace and forms,,,
REQPRODUCTIONPLANNER,Production planner,Enable rule to turn off Master planning processes,,,,
REQPRODUCTIONPLANNER,Production planner,Inquire into electronic batch records,,,,
RETAILCATALOGMANAGER,Retail catalog manager,Maintain all category hierarchy details,,,,
RETAILCATALOGMANAGER,Retail catalog manager,Maintain all category hierarchy details,,,,
RETAILCATALOGMANAGER,Retail catalog manager,Process catalog requests,,,,
RETAILCATALOGMANAGER,Retail catalog manager,View call center channel,,,,
RETAILCATALOGMANAGER,Retail catalog manager,Maintain source code and catalog,,,,
RETAILCATALOGMANAGER,Retail catalog manager,Maintain retail add products lists,,,,
RETAILCATALOGMANAGER,Retail catalog manager,View retail assortments,,,,
RETAILCATALOGMANAGER,Retail catalog manager,Retail catalog approval workflow duty,,,,
RETAILCATALOGMANAGER,Retail catalog manager,Maintain retail catalog,,,,
RETAILCATALOGMANAGER,Retail catalog manager,View retail channels,,,,
RETAILCATALOGMANAGER,Retail catalog manager,Maintain retail product reference data,,,,
RETAILCATALOGMANAGER,Retail catalog manager,Maintain retail kits,,,,
RETAILCATALOGMANAGER,Retail catalog manager,Operating unit picker,,,,
RETAILCATALOGMANAGER,Retail catalog manager,Maintain trade allowance statistics,,,,
RETAILCATALOGMANAGER,Retail catalog manager,Enhanced preview for released products,,,,
RETAILCATALOGMANAGER,Retail catalog manager,Maintain product categorization,,,,
RETAILCATALOGMANAGER,Retail catalog manager,Maintain procurement category hierarchy,,,,
RETAILCATALOGMANAGER,Retail catalog manager,Maintain media management security.,,,,
RETAILCATALOGMANAGER,Retail catalog manager,View recommendation lists,,,,
RETAILCATALOGMANAGER,Retail catalog manager,View task management process,,,,
RETAILCATALOGMANAGER,Retail catalog manager,View warranty groups,,,,
RETAILCATALOGMANAGER,Retail catalog manager,View warranty settings,,,,
RETAILCATALOGMANAGER,Retail catalog manager,RetailCatalogManagementWorkspaceMaintain,,,,
RETAILMERCHANDISINGMANAGER,Retail merchandising manager,Maintain all category hierarchy details,,,,
RETAILMERCHANDISINGMANAGER,Retail merchandising manager,Maintain all category hierarchy details,,,,
RETAILMERCHANDISINGMANAGER,Retail merchandising manager,View call center channel,,,,
RETAILMERCHANDISINGMANAGER,Retail merchandising manager,Maintain installment billing setup,,,,
RETAILMERCHANDISINGMANAGER,Retail merchandising manager,Maintain retail add products lists,,,,
RETAILMERCHANDISINGMANAGER,Retail merchandising manager,Maintain retail assortments,,,,
RETAILMERCHANDISINGMANAGER,Retail merchandising manager,Maintain retail barcodes,,,,
RETAILMERCHANDISINGMANAGER,Retail merchandising manager,View retail catalog,,,,
RETAILMERCHANDISINGMANAGER,Retail merchandising manager,Maintain retail campaign discounts,,,,
RETAILMERCHANDISINGMANAGER,Retail merchandising manager,Inquire into retail sales reports,,,,
RETAILMERCHANDISINGMANAGER,Retail merchandising manager,Inquire into retail statements,,,,
RETAILMERCHANDISINGMANAGER,Retail merchandising manager,Maintain retail product links,,,,
RETAILMERCHANDISINGMANAGER,Retail merchandising manager,Maintain retail product reference data,,,,
RETAILMERCHANDISINGMANAGER,Retail merchandising manager,Maintain retail kits,,,,
RETAILMERCHANDISINGMANAGER,Retail merchandising manager,Edit mass update worksheets,,,,
RETAILMERCHANDISINGMANAGER,Retail merchandising manager,Operating unit picker,,,,
RETAILMERCHANDISINGMANAGER,Retail merchandising manager,Maintain retail product pricing,,,,
RETAILMERCHANDISINGMANAGER,Retail merchandising manager,Maintain retail product reference data,,,,
RETAILMERCHANDISINGMANAGER,Retail merchandising manager,Enhanced preview for released products,,,,
RETAILMERCHANDISINGMANAGER,Retail merchandising manager,Maintain procurement category hierarchy,,,,
RETAILMERCHANDISINGMANAGER,Retail merchandising manager,Maintain product categorization,,,,
RETAILMERCHANDISINGMANAGER,Retail merchandising manager,Retail workflow configuration,,,,
RETAILMERCHANDISINGMANAGER,Retail merchandising manager,Maintain media management security.,,,,
RETAILMERCHANDISINGMANAGER,Retail merchandising manager,Channel categories and product attributes,,,,
RETAILMERCHANDISINGMANAGER,Retail merchandising manager,Maintain recommendation lists,,,,
RETAILMERCHANDISINGMANAGER,Retail merchandising manager,View task management process,,,,
RETAILMERCHANDISINGMANAGER,Retail merchandising manager,Maintain warranty groups,,,,
RETAILMERCHANDISINGMANAGER,Retail merchandising manager,Maintian warranty settings,,,,
RETAILMERCHANDISINGMANAGER,Retail merchandising manager,Inquire into RFID/barcode master,,,,
RETAILMERCHANDISINGMANAGER,Retail merchandising manager,Maintain channel merchandising configuration validations,,,,
RETAILMERCHANDISINGMANAGER,Retail merchandising manager,UnifiedPricingMaintain,,,,
RETAILMERCHANDISINGMANAGER,Retail merchandising manager,RetailCategoryAndProductWorkspaceMaintain,,,,
RETAILMERCHANDISINGMANAGER,Retail merchandising manager,Maintain commerce pricing and discount management workspace,,,,
RETAILMERCHANDISINGMANAGER,Retail merchandising manager,Maintain pricing management workspace,,,,
RETAILMERCHANDISINGMANAGER,Retail merchandising manager,Enable pricing setting process,,,,
RETAILMERCHANDISINGMANAGER,Retail merchandising manager,Maintain sales base price,,,,
RETAILMERCHANDISINGMANAGER,Retail merchandising manager,Maintain vendor price groups,,,,
RETAILMERCHANDISINGMANAGER,Retail merchandising manager,Maintain activation of base price,,,,
RETAILOPERATIONSMANAGER,Retail operations manager,Inquire into customer master,,,,
RETAILOPERATIONSMANAGER,Retail operations manager,View sensitive customer information,,,,
RETAILOPERATIONSMANAGER,Retail operations manager,Enhanced preview for released products,,,,
RETAILOPERATIONSMANAGER,Retail operations manager,View basic information about workers in the system,,,,
RETAILOPERATIONSMANAGER,Retail operations manager,Inquire into workers,,,,
RETAILOPERATIONSMANAGER,Retail operations manager,Maintain call center channels,,,,
RETAILOPERATIONSMANAGER,Retail operations manager,Maintain account export,,,,
RETAILOPERATIONSMANAGER,Retail operations manager,Maintain retail add products lists,,,,
RETAILOPERATIONSMANAGER,Retail operations manager,View retail assortments,,,,
RETAILOPERATIONSMANAGER,Retail operations manager,Maintain retail barcode masks,,,,
RETAILOPERATIONSMANAGER,Retail operations manager,Maintain retail batches,,,,
RETAILOPERATIONSMANAGER,Retail operations manager,Manage Commerce Data Exchange: Synch Service,,,,
RETAILOPERATIONSMANAGER,Retail operations manager,Maintain Retail Channel Reports,,,,
RETAILOPERATIONSMANAGER,Retail operations manager,Maintain retail channels,,,,
RETAILOPERATIONSMANAGER,Retail operations manager,Maintain retail counting and receiving,,,,
RETAILOPERATIONSMANAGER,Retail operations manager,Maintain retail counting,,,,
RETAILOPERATIONSMANAGER,Retail operations manager,View Email notification forms,,,,
RETAILOPERATIONSMANAGER,Retail operations manager,Maintain retail gift cards,,,,
RETAILOPERATIONSMANAGER,Retail operations manager,Maintain retail gift cards,,,,
RETAILOPERATIONSMANAGER,Retail operations manager,Maintain retail income and expense,,,,
RETAILOPERATIONSMANAGER,Retail operations manager,Maintain retail infocodes,,,,
RETAILOPERATIONSMANAGER,Retail operations manager,Inquire into retail sales reports,,,,
RETAILOPERATIONSMANAGER,Retail operations manager,Inquire into retail shifts,,,,
RETAILOPERATIONSMANAGER,Retail operations manager,Inquire into retail statements,,,,
RETAILOPERATIONSMANAGER,Retail operations manager,Maintain inventory availability service,,,,
RETAILOPERATIONSMANAGER,Retail operations manager,View retail product links,,,,
RETAILOPERATIONSMANAGER,Retail operations manager,Maintain retail labels,,,,
RETAILOPERATIONSMANAGER,Retail operations manager,Maintain retail loyalty,,,,
RETAILOPERATIONSMANAGER,Retail operations manager,Operating unit picker,,,,
RETAILOPERATIONSMANAGER,Retail operations manager,Maintain retail parameters,,,,
RETAILOPERATIONSMANAGER,Retail operations manager,Maintain retail POS permissions,,,,
RETAILOPERATIONSMANAGER,Retail operations manager,Retail redeployment duty,,,,
RETAILOPERATIONSMANAGER,Retail operations manager,RetailProductPricingView,,,,
RETAILOPERATIONSMANAGER,Retail operations manager,Maintain retail campaign discounts,,,,
RETAILOPERATIONSMANAGER,Retail operations manager,Maintain retail reference data,,,,
RETAILOPERATIONSMANAGER,Retail operations manager,Maintain retail replenishment,,,,
RETAILOPERATIONSMANAGER,Retail operations manager,Maintain retail rounding,,,,
RETAILOPERATIONSMANAGER,Retail operations manager,Prepayment,,,,
RETAILOPERATIONSMANAGER,Retail operations manager,Manage Commerce Data Exchange: Synch Service,,,,
RETAILOPERATIONSMANAGER,Retail operations manager,Maintain retail statements,,,,
RETAILOPERATIONSMANAGER,Retail operations manager,Maintain Commerce Data Exchange: Synch Service Execution,,,,
RETAILOPERATIONSMANAGER,Retail operations manager,Maintain retail store inventory reference data,,,,
RETAILOPERATIONSMANAGER,Retail operations manager,Maintain retail store inventory worksheets,,,,
RETAILOPERATIONSMANAGER,Retail operations manager,Maintain store locator groups,,,,
RETAILOPERATIONSMANAGER,Retail operations manager,Maintain retail store tenders,,,,
RETAILOPERATIONSMANAGER,Retail operations manager,Maintain retail tax reference data,,,,
RETAILOPERATIONSMANAGER,Retail operations manager,Maintain retail register profiles,,,,
RETAILOPERATIONSMANAGER,Retail operations manager,Maintain retail register reference data,,,,
RETAILOPERATIONSMANAGER,Retail operations manager,Maintain retail registers,,,,
RETAILOPERATIONSMANAGER,Retail operations manager,Maintain retail till activities,,,,
RETAILOPERATIONSMANAGER,Retail operations manager,Maintain Commerce Data Exchange: Real-time Service profiles,,,,
RETAILOPERATIONSMANAGER,Retail operations manager,View retail transactions,,,,
RETAILOPERATIONSMANAGER,Retail operations manager,Maintain retail worker,,,,
RETAILOPERATIONSMANAGER,Retail operations manager,Retail workflow configuration,,,,
RETAILOPERATIONSMANAGER,Retail operations manager,Inquire Retail Z reports,,,,
RETAILOPERATIONSMANAGER,Retail operations manager,Generate retail open statement report,,,,
RETAILOPERATIONSMANAGER,Retail operations manager,Maintain setup for retail gift cards,,,,
RETAILOPERATIONSMANAGER,Retail operations manager,Maintain Retail delivery mode,,,,
RETAILOPERATIONSMANAGER,Retail operations manager,Inquire into retail sales operations reports.,,,,
RETAILOPERATIONSMANAGER,Retail operations manager,Inquire into retail store manager reports.,,,,
RETAILOPERATIONSMANAGER,Retail operations manager,Maintain retail coupons,,,,
RETAILOPERATIONSMANAGER,Retail operations manager,Approve physical inventory counting,,,,
RETAILOPERATIONSMANAGER,Retail operations manager,Approve inventory adjustment journal,,,,
RETAILOPERATIONSMANAGER,Retail operations manager,Maintain retail period grand total journal,,,,
RETAILOPERATIONSMANAGER,Retail operations manager,Maintain retail customer search field,,,,
RETAILOPERATIONSMANAGER,Retail operations manager,Maintain retail customer search field translation,,,,
RETAILOPERATIONSMANAGER,Retail operations manager,RetailStoreHoursMaintain,,,,
RETAILOPERATIONSMANAGER,Retail operations manager,Maintain retail transactions,,,,
RETAILOPERATIONSMANAGER,Retail operations manager,Permission to view ChargeOverrideHistory,,,,
RETAILOPERATIONSMANAGER,Retail operations manager,Maintain product ratings,,,,
RETAILOPERATIONSMANAGER,Retail operations manager,RetailRatingsAndReviewsConnectorMaintain,,,,
RETAILOPERATIONSMANAGER,Retail operations manager,RetailClientBookMaintain,,,,
RETAILOPERATIONSMANAGER,Retail operations manager,View task management process,,,,
RETAILOPERATIONSMANAGER,Retail operations manager,RetailClientelingParametersMaintain,,,,
RETAILOPERATIONSMANAGER,Retail operations manager,View warranty groups,,,,
RETAILOPERATIONSMANAGER,Retail operations manager,View warranty settings,,,,
RETAILOPERATIONSMANAGER,Retail operations manager,View inventory levels,,,,
RETAILOPERATIONSMANAGER,Retail operations manager,Dynamics 365 Fraud Protection (DFP) Loss Prevention,,,,
RETAILOPERATIONSMANAGER,Retail operations manager,Maintain retail document operation,,,,
RETAILOPERATIONSMANAGER,Retail operations manager,View customer hierachies,,,,
RETAILOPERATIONSMANAGER,Retail operations manager,Maintain customer hierarchies,,,,
RETAILOPERATIONSMANAGER,Retail operations manager,RetailPickupTimeslotMaintain,,,,
RETAILOPERATIONSMANAGER,Retail operations manager,RetailCustSynchronizationMaintain,,,,
RETAILOPERATIONSMANAGER,Retail operations manager,UnifiedPricingView,,,,
RETAILOPERATIONSMANAGER,Retail operations manager,Maintain Calculated statement,,,,
RETAILOPERATIONSMANAGER,Retail operations manager,DataValidationProjectCreator,,,,
RETAILOPERATIONSMANAGER,Retail operations manager,RetailChannelWorkspaceMaintain,,,,
RETAILOPERATIONSMANAGER,Retail operations manager,RetailStoreManagementWorkspaceMaintain,,,,
RETAILOPERATIONSMANAGER,Retail operations manager,RetailChannelOperationsWorkspaceMaintain,,,,
RETAILOPERATIONSMANAGER,Retail operations manager,RetailPaymentDiagnosticsToolMaintain,,,,
RETAILOPERATIONSMANAGER,Retail operations manager,Enable pricing setting process,,,,
RETAILOPERATIONSMANAGER,Retail operations manager,Maintain retail parameters,,,,
RETAILOPERATIONSMANAGER,Retail operations manager,Inquire into quotation to sales order policies,,,,
RETAILSERVICE,Retail service,Manage retail real-time service operation.,,,,
RETAILSERVICE,Retail service,Maintain all category hierarchy details,,,,
RETAILSERVICE,Retail service,Maintain all category hierarchy details,,,,
RETAILSERVICE,Retail service,View call center channel,,,,
RETAILSERVICE,Retail service,Maintain installment billing setup,,,,
RETAILSERVICE,Retail service,Maintain retail add products lists,,,,
RETAILSERVICE,Retail service,Maintain retail assortments,,,,
RETAILSERVICE,Retail service,Maintain retail barcodes,,,,
RETAILSERVICE,Retail service,View retail catalog,,,,
RETAILSERVICE,Retail service,Maintain retail campaign discounts,,,,
RETAILSERVICE,Retail service,Inquire into retail sales reports,,,,
RETAILSERVICE,Retail service,Inquire into retail statements,,,,
RETAILSERVICE,Retail service,Maintain retail product links,,,,
RETAILSERVICE,Retail service,Maintain retail product reference data,,,,
RETAILSERVICE,Retail service,Maintain retail kits,,,,
RETAILSERVICE,Retail service,Edit mass update worksheets,,,,
RETAILSERVICE,Retail service,Operating unit picker,,,,
RETAILSERVICE,Retail service,Maintain retail product pricing,,,,
RETAILSERVICE,Retail service,Maintain retail product reference data,,,,
RETAILSERVICE,Retail service,Enhanced preview for released products,,,,
RETAILSERVICE,Retail service,Maintain procurement category hierarchy,,,,
RETAILSERVICE,Retail service,Maintain product categorization,,,,
RETAILSERVICE,Retail service,Retail workflow configuration,,,,
RETAILSERVICE,Retail service,Maintain account export,,,,
RETAILSERVICE,Retail service,View retail assortments,,,,
RETAILSERVICE,Retail service,Maintain retail barcode masks,,,,
RETAILSERVICE,Retail service,Maintain retail batches,,,,
RETAILSERVICE,Retail service,Manage Commerce Data Exchange: Synch Service,,,,
RETAILSERVICE,Retail service,Maintain Retail Channel Reports,,,,
RETAILSERVICE,Retail service,Maintain retail channels,,,,
RETAILSERVICE,Retail service,Maintain retail counting and receiving,,,,
RETAILSERVICE,Retail service,Maintain retail counting,,,,
RETAILSERVICE,Retail service,View Email notification forms,,,,
RETAILSERVICE,Retail service,Maintain retail gift cards,,,,
RETAILSERVICE,Retail service,Maintain retail gift cards,,,,
RETAILSERVICE,Retail service,Maintain retail income and expense,,,,
RETAILSERVICE,Retail service,Maintain retail infocodes,,,,
RETAILSERVICE,Retail service,Inquire into retail shifts,,,,
RETAILSERVICE,Retail service,Maintain inventory availability service,,,,
RETAILSERVICE,Retail service,View retail product links,,,,
RETAILSERVICE,Retail service,Maintain retail labels,,,,
RETAILSERVICE,Retail service,Maintain retail loyalty,,,,
RETAILSERVICE,Retail service,Maintain retail POS permissions,,,,
RETAILSERVICE,Retail service,Retail redeployment duty,,,,
RETAILSERVICE,Retail service,Maintain retail campaign discounts,,,,
RETAILSERVICE,Retail service,Maintain retail reference data,,,,
RETAILSERVICE,Retail service,Maintain retail replenishment,,,,
RETAILSERVICE,Retail service,Maintain retail rounding,,,,
RETAILSERVICE,Retail service,Prepayment,,,,
RETAILSERVICE,Retail service,Manage Commerce Data Exchange: Synch Service,,,,
RETAILSERVICE,Retail service,Maintain retail statements,,,,
RETAILSERVICE,Retail service,Maintain Commerce Data Exchange: Synch Service Execution,,,,
RETAILSERVICE,Retail service,Maintain retail store inventory reference data,,,,
RETAILSERVICE,Retail service,Maintain retail store inventory worksheets,,,,
RETAILSERVICE,Retail service,Maintain store locator groups,,,,
RETAILSERVICE,Retail service,Maintain retail store tenders,,,,
RETAILSERVICE,Retail service,Maintain retail tax reference data,,,,
RETAILSERVICE,Retail service,Maintain retail register profiles,,,,
RETAILSERVICE,Retail service,Maintain retail register reference data,,,,
RETAILSERVICE,Retail service,Maintain retail registers,,,,
RETAILSERVICE,Retail service,Maintain retail till activities,,,,
RETAILSERVICE,Retail service,View retail transactions,,,,
RETAILSERVICE,Retail service,Maintain retail worker,,,,
RETAILSERVICE,Retail service,Inquire Retail Z reports,,,,
RETAILSERVICE,Retail service,Generate retail open statement report,,,,
RETAILSERVICE,Retail service,Maintain call center channels,,,,
RETAILSERVICE,Retail service,Inquire into workers,,,,
RETAILSERVICE,Retail service,Inquire into customer master,,,,
RETAILSERVICE,Retail service,RetailProvisioningServiceMaintain,,,,
RETAILSERVICE,Retail service,Role center URL redirection,,,,
RETAILSERVICE,Retail service,Retail deployment self service,,,,
RETAILSERVICE,Retail service,Use basic functionality,,,,
RETAILSERVICE,Retail service,Inquire into inventory status,,,,
RETAILSERVICE,Retail service,Maintain inventory transfers,,,,
RETAILSERVICE,Retail service,Approve time and attendance payroll,,,,
RETAILSERVICE,Retail service,Maintain purchase orders,,,,
RETAILSERVICE,Retail service,Maintain purchase requisitions,,,,
RETAILSERVICE,Retail service,Inquire into sales return order progress,,,,
RETAILSERVICE,Retail service,Inquire into sales order progress,,,,
RETAILSERVICE,Retail service,Inquire into quotation progress,,,,
RETAILSERVICE,Retail service,Maintain kit assembly orders,,,,
RETAILSERVICE,Retail service,Record retail counting and picking,,,,
RETAILSERVICE,Retail service,Maintain sales order,,,,
RETAILSERVICE,Retail service,Maintain sales order,,,,
RETAILSERVICE,Retail service,Maintain sales order release from agreements,,,,
RETAILSERVICE,Retail service,Maintain sales order entry deadlines,,,,
RETAILSERVICE,Retail service,Enable quotation to sales order process,,,,
RETAILSERVICE,Retail service,Inquire into quotation to sales order reference data,,,,
RETAILSERVICE,Retail service,Release to warehouse,,,,
RETAILSERVICE,Retail service,Inquire into retail sales operations reports.,,,,
RETAILSERVICE,Retail service,Inquire into retail store manager reports.,,,,
RETAILSERVICE,Retail service,Inquire into consignment replenishment orders,,,,
RETAILSERVICE,Retail service,TaxIdentificationDimensionMaintain,,,,
RETAILSERVICE,Retail service,RetailFiscalIntegrationMaintain,,,,
RETAILSERVICE,Retail service,RetailStoreHoursMaintain,,,,
RETAILSERVICE,Retail service,Maintain tax document transit relation,,,,
RETAILSERVICE,Retail service,Maintain tax document temporary table,,,,
RETAILSERVICE,Retail service,Maintain relationship between mapping table and attribute table,,,,
RETAILSERVICE,Retail service,Maintain tax document transaction,,,,
RETAILSERVICE,Retail service,Maintain tax document,,,,
RETAILSERVICE,Retail service,RetailClientBookMaintain,,,,
RETAILSERVICE,Retail service,View task management process,,,,
