RoleID,RoleName,DutyName,,,,
WMSWAREHOUSEWORKER,Warehouse worker,Maintain inventory transfers,,,,
WMSWAREHOUSEWORKER,Warehouse worker,Maintain materials kanban execution,,,,
WMSWAREHOUSEWORKER,Warehouse worker,Inquire into picking processes,,,,
WMSWAREHOUSEWORKER,Warehouse worker,Inquire into packing operations master,,,,
WMSWAREHOUSEWORKER,Warehouse worker,View tax branches,,,,
WMSWAREHOUSEWORKER,Warehouse worker,Maintain license plate master,,,,
WMSWAREHOUSEWORKER,Warehouse worker,Inquire into warehouse planning status,,,,
WMSWAREHOUSEWORKER,Warehouse worker,Maintain physical quantity adjustment,,,,
WMSWAREHOUSEWORKER,Warehouse worker,Inquire into warehouse operation progress,,,,
WMSWAREHOUSEWORKER,Warehouse worker,Maintain warehouse picking operations,,,,
WMSWAREHOUSEWORKER,Warehouse worker,Enhanced preview for released products,,,,
WMSWAREHOUSEWORKER,Warehouse worker,Generate goods receipt note,,,,
WMSWAREHOUSEWORKER,Warehouse worker,View goods receipt note,,,,
WMSWAREHOUSEWORKER,Warehouse worker,Maintain invent site gate,,,,
WMSWAREHOUSEWORKER,Warehouse worker,View invent site gate,,,,
WMSWAREHOUSEWORKER,Warehouse worker,Maintain goods receipt note,,,,
WMSWAREHOUSEWORKER,Warehouse worker,Maintain EGAIS,,,,
WMSWAREHOUSEWORKER,Warehouse worker,Warehouse Operation Master Inquire,,,,
WMSWAREHOUSEWORKER,Warehouse worker,Maintain inventory journal workflow.,,,,
WMSWAREHOUSEWORKER,Warehouse worker,Inquire into transfer orders using data services,,,,
WMSWAREHOUSEWORKER,Warehouse worker,Maintain transfer orders using data services,,,,
WMSWAREHOUSEWORKER,Warehouse worker,Maintain cycle count work accept and reject buttons,,,,
WMSWAREHOUSEWORKER,Warehouse worker,View GS1 setup,,,,
WMSWAREHOUSEWORKER,Warehouse worker,Generate custom labels,,,,
WMSWAREHOUSEWORKER,Warehouse worker,Warehouse orders entity integration maintain,,,,
PAYMPOSITIVEPAYMENTCLERK,Accounts payable positive payment clerk,View sensitive bank account information for company accounts,,,,
PAYMPOSITIVEPAYMENTCLERK,Accounts payable positive payment clerk,Inquire into customer positive payments,,,,
PAYMPOSITIVEPAYMENTCLERK,Accounts payable positive payment clerk,Inquire into vendor positive payments,,,,
PAYMPOSITIVEPAYMENTCLERK,Accounts payable positive payment clerk,View sensitive vendor bank account information,,,,
PAYMPOSITIVEPAYMENTCLERK,Accounts payable positive payment clerk,TaxIdentificationDimensionView,,,,
SYSDOCUBRANDADMIN,System document branding administrator,SysDocuBrandMaintain,,,,
VENDVENDORCONTACT,Vendor contact (external),Maintain process purchase orders,,,,
VENDVENDORCONTACT,Vendor contact (external),Maintain vendor collaboration invoices,,,,
VENDVENDORCONTACT,Vendor contact (external),View consignment inventory,,,,
VENDVENDORCONTACT,Vendor contact (external),View vendor profile,,,,
VENDVENDORCONTACT,Vendor contact (external),View company information in the vendor collaboration interface,,,,
VENDVENDORCONTACT,Vendor contact (external),Maintain vendor requests for quotations replies,,,,
VENDVENDORCONTACT,Vendor contact (external),Inquire into request for quotation for vendor,,,,
VENDVENDORCONTACT,Vendor contact (external),Inquire into published requests for quotations,,,,
VENDVENDORCONTACT,Vendor contact (external),Maintain published requests for quotations,,,,
VENDVENDORCONTACT,Vendor contact (external),Maintain request for quotation for vendor,,,,
TRADECUSTOMERSERVICEREPRESENTATIVE,Customer service representative,Review case process,,,,
TRADECUSTOMERSERVICEREPRESENTATIVE,Customer service representative,Maintain cases,,,,
TRADECUSTOMERSERVICEREPRESENTATIVE,Customer service representative,Maintain sales cases,,,,
TRADECUSTOMERSERVICEREPRESENTATIVE,Customer service representative,Maintain service cases,,,,
TRADECUSTOMERSERVICEREPRESENTATIVE,Customer service representative,Inquire into customer master,,,,
TRADECUSTOMERSERVICEREPRESENTATIVE,Customer service representative,Role center URL redirection,,,,
TRADECUSTOMERSERVICEREPRESENTATIVE,Customer service representative,Inquire into related inventory status,,,,
TRADECUSTOMERSERVICEREPRESENTATIVE,Customer service representative,Maintain correction of serial numbers,,,,
TRADECUSTOMERSERVICEREPRESENTATIVE,Customer service representative,Maintain registration of unreadable serial numbers,,,,
TRADECUSTOMERSERVICEREPRESENTATIVE,Customer service representative,Maintain service event groups,,,,
TRADECUSTOMERSERVICEREPRESENTATIVE,Customer service representative,Process catalog requests,,,,
TRADECUSTOMERSERVICEREPRESENTATIVE,Customer service representative,Merge and unmerge customers,,,,
TRADECUSTOMERSERVICEREPRESENTATIVE,Customer service representative,Maintain customer service,,,,
TRADECUSTOMERSERVICEREPRESENTATIVE,Customer service representative,Inquire into order events,,,,
TRADECUSTOMERSERVICEREPRESENTATIVE,Customer service representative,Maintain sales return order,,,,
TRADECUSTOMERSERVICEREPRESENTATIVE,Customer service representative,Maintain sales order holds,,,,
TRADECUSTOMERSERVICEREPRESENTATIVE,Customer service representative,Maintain sales order,,,,
TRADECUSTOMERSERVICEREPRESENTATIVE,Customer service representative,Approve return acknowledgement,,,,
TRADECUSTOMERSERVICEREPRESENTATIVE,Customer service representative,Maintain sales return order,,,,
TRADECUSTOMERSERVICEREPRESENTATIVE,Customer service representative,Inquire into sales return order progress,,,,
TRADECUSTOMERSERVICEREPRESENTATIVE,Customer service representative,Inquire into sales order progress,,,,
TRADECUSTOMERSERVICEREPRESENTATIVE,Customer service representative,Maintain sales packing slip,,,,
TRADECUSTOMERSERVICEREPRESENTATIVE,Customer service representative,Maintain service orders,,,,
TRADECUSTOMERSERVICEREPRESENTATIVE,Customer service representative,Maintain activities,,,,
TRADECUSTOMERSERVICEREPRESENTATIVE,Customer service representative,Review prospects,,,,
TRADECUSTOMERSERVICEREPRESENTATIVE,Customer service representative,Maintain prospects,,,,
TRADECUSTOMERSERVICEREPRESENTATIVE,Customer service representative,Maintain contacts,,,,
TRADECUSTOMERSERVICEREPRESENTATIVE,Customer service representative,Inquire into knowledge articles,,,,
TRADECUSTOMERSERVICEREPRESENTATIVE,Customer service representative,Inquire into leads and opportunities,,,,
TRADECUSTOMERSERVICEREPRESENTATIVE,Customer service representative,Enhanced preview for released products,,,,
TRADECUSTOMERSERVICEREPRESENTATIVE,Customer service representative,Synchronize online orders,,,,
TRADECUSTOMERSERVICEREPRESENTATIVE,Customer service representative,Maintain tax document temporary table,,,,
TRADECUSTOMERSERVICEREPRESENTATIVE,Customer service representative,Maintain tax document transit relation,,,,
TRADECUSTOMERSERVICEREPRESENTATIVE,Customer service representative,Maintain relationship between mapping table and attribute table,,,,
TRADECUSTOMERSERVICEREPRESENTATIVE,Customer service representative,Maintain tax document transaction,,,,
TRADECUSTOMERSERVICEREPRESENTATIVE,Customer service representative,Maintain tax document,,,,
TRADECUSTOMERSERVICEREPRESENTATIVE,Customer service representative,Inquire into cash flow management process,,,,
TRADECUSTOMERSERVICEREPRESENTATIVE,Customer service representative,Maintain cash flow management process,,,,
TRADECUSTOMERSERVICEREPRESENTATIVE,Customer service representative,Inquire into payment request status,,,,
TRADECUSTOMERSERVICEREPRESENTATIVE,Customer service representative,Synchronize order templates,,,,
TRADECUSTOMERSERVICEREPRESENTATIVE,Customer service representative,Cancel kit remainder,,,,
TRADECUSTOMERSERVICEREPRESENTATIVE,Customer service representative,Inquire into approved customer list,,,,
DATAMANAGEMENTADMINISTRATOR,Data management administrator,Maintain data import export parameters, entity data synchronization, data templates, data projects, recurring data jobs and staging data
DATAMANAGEMENTADMINISTRATOR,Data management administrator,Maintain data sharing policies,,,,
DATAMANAGEMENTADMINISTRATOR,Data management administrator,PersonnellIntegrationConfigurationMaintain,,,,
DATAMANAGEMENTADMINISTRATOR,Data management administrator,DataValidationProjectCreator,,,,
DATAMANAGEMENTADMINISTRATOR,Data management administrator,Maintain data validation checklist entities,,,,
DATAMANAGEMENTADMINISTRATOR,Data management administrator,Maintain Configuration entity data in foundation for data management,,,,
DATAMANAGEMENTADMINISTRATOR,Data management administrator,View Configuration entity data in foundation for data management,,,,
DATAMANAGEMENTADMINISTRATOR,Data management administrator,Maintain Master entity data in foundation for data management,,,,
DATAMANAGEMENTADMINISTRATOR,Data management administrator,View Master entity data in foundation for data management,,,,
DATAMANAGEMENTADMINISTRATOR,Data management administrator,Parameters,,,,
DATAMANAGEMENTADMINISTRATOR,Data management administrator,View Parameters entity data in foundation for data management,,,,
DATAMANAGEMENTADMINISTRATOR,Data management administrator,Maintain Reference entity data in foundation for data management,,,,
DATAMANAGEMENTADMINISTRATOR,Data management administrator,View Reference entity data in foundation for data management,,,,
DATAMANAGEMENTADMINISTRATOR,Data management administrator,Maintain Mixed Reality master entity data for data management,,,,
DATAMANAGEMENTADMINISTRATOR,Data management administrator,View Mixed Reality master entity data for data management,,,,
DATAMANAGEMENTADMINISTRATOR,Data management administrator,Maintain and configure team-related entities.,,,,
DATAMANAGEMENTADMINISTRATOR,Data management administrator,View team-related entities.,,,,
DATAMANAGEMENTADMINISTRATOR,Data management administrator,View fiscal calendar entities duty.,,,,
DATAMANAGEMENTADMINISTRATOR,Data management administrator,Maintain fiscal calendar entities duty.,,,,
DATAMANAGEMENTADMINISTRATOR,Data management administrator,Maintain currency entities master,,,,
DATAMANAGEMENTADMINISTRATOR,Data management administrator,View currency entities master,,,,
DATAMANAGEMENTADMINISTRATOR,Data management administrator,Maintain Master entity data for data management,,,,
DATAMANAGEMENTADMINISTRATOR,Data management administrator,View Master entity data for data management,,,,
DATAMANAGEMENTADMINISTRATOR,Data management administrator,Maintain Reference entity data for data management,,,,
DATAMANAGEMENTADMINISTRATOR,Data management administrator,View Reference entity data for data management,,,,
DATAMANAGEMENTADMINISTRATOR,Data management administrator,Maintain ledger entities master,,,,
DATAMANAGEMENTADMINISTRATOR,Data management administrator,View ledger entities master,,,,
DATAMANAGEMENTADMINISTRATOR,Data management administrator,Maintain Case Management document entity data for data management,,,,
DATAMANAGEMENTADMINISTRATOR,Data management administrator,View Case Management document entity data for data management,,,,
DATAMANAGEMENTADMINISTRATOR,Data management administrator,Maintain Case Management document entity data for data management,,,,
DATAMANAGEMENTADMINISTRATOR,Data management administrator,View Case Management document entity data for data management,,,,
DATAMANAGEMENTADMINISTRATOR,Data management administrator,Maintain Document entity data for data management,,,,
DATAMANAGEMENTADMINISTRATOR,Data management administrator,View Document entity data for data management,,,,
DATAMANAGEMENTADMINISTRATOR,Data management administrator,Maintain Master entity data for data management,,,,
DATAMANAGEMENTADMINISTRATOR,Data management administrator,View Master entity data for data management,,,,
DATAMANAGEMENTADMINISTRATOR,Data management administrator,Maintain Parameters entity data for data management,,,,
DATAMANAGEMENTADMINISTRATOR,Data management administrator,View Parameters entity data for data management,,,,
DATAMANAGEMENTADMINISTRATOR,Data management administrator,Maintain Reference entity data for data management,,,,
DATAMANAGEMENTADMINISTRATOR,Data management administrator,View Reference entity data for data management,,,,
DATAMANAGEMENTADMINISTRATOR,Data management administrator,Maintain Transaction entity data for data management,,,,
DATAMANAGEMENTADMINISTRATOR,Data management administrator,View Transaction entity data for data management,,,,
DATAMANAGEMENTADMINISTRATOR,Data management administrator,Maintain sensitive information for Bank accounts entity,,,,
DATAMANAGEMENTADMINISTRATOR,Data management administrator,Maintain sensitive bank account information for company accounts,,,,
DATAMANAGEMENTADMINISTRATOR,Data management administrator,Maintain sensitive information for Bank positive pay transactions entity,,,,
DATAMANAGEMENTADMINISTRATOR,Data management administrator,Maintain Document entity data for data management,,,,
DATAMANAGEMENTADMINISTRATOR,Data management administrator,View Document entity data for data management,,,,
DATAMANAGEMENTADMINISTRATOR,Data management administrator,Maintain Master entity data for data management,,,,
DATAMANAGEMENTADMINISTRATOR,Data management administrator,View Master entity data for data management,,,,
DATAMANAGEMENTADMINISTRATOR,Data management administrator,Maintain Parameters entity data for data management,,,,
DATAMANAGEMENTADMINISTRATOR,Data management administrator,View Parameters entity data for data management,,,,
DATAMANAGEMENTADMINISTRATOR,Data management administrator,Maintain Reference entity data for data management,,,,
DATAMANAGEMENTADMINISTRATOR,Data management administrator,View Reference entity data for data management,,,,
DATAMANAGEMENTADMINISTRATOR,Data management administrator,Maintain Transaction entity data for data management,,,,
DATAMANAGEMENTADMINISTRATOR,Data management administrator,View Transaction entity data for data management,,,,
DATAMANAGEMENTADMINISTRATOR,Data management administrator,PayrollPositivePayExportStagingTPFMaintain,,,,
DATAMANAGEMENTADMINISTRATOR,Data management administrator,Maintain Configuration entity data for data management,,,,
DATAMANAGEMENTADMINISTRATOR,Data management administrator,View Configuration entity data for data management,,,,
DATAMANAGEMENTADMINISTRATOR,Data management administrator,Maintain financial reporting entity data for data management,,,,
DATAMANAGEMENTADMINISTRATOR,Data management administrator,View financial reporting entity data for data management,,,,
DATAMANAGEMENTADMINISTRATOR,Data management administrator,Maintain BOM master through services,,,,
DATAMANAGEMENTADMINISTRATOR,Data management administrator,Inquire into BOM master through services,,,,
DATAMANAGEMENTADMINISTRATOR,Data management administrator,Maintain route master through services,,,,
DATAMANAGEMENTADMINISTRATOR,Data management administrator,Inquire into route master through services,,,,
DATAMANAGEMENTADMINISTRATOR,Data management administrator,Maintain configuration entity data for data management (Extension),,,,
DATAMANAGEMENTADMINISTRATOR,Data management administrator,View configuration entity data for data management (Extension),,,,
DATAMANAGEMENTADMINISTRATOR,Data management administrator,Maintain document entity data for data management (Extension),,,,
DATAMANAGEMENTADMINISTRATOR,Data management administrator,View document entity data for data management (Extension),,,,
DATAMANAGEMENTADMINISTRATOR,Data management administrator,Maintain master entity data for data management (Extension),,,,
DATAMANAGEMENTADMINISTRATOR,Data management administrator,View master entity data for data management (Extension),,,,
DATAMANAGEMENTADMINISTRATOR,Data management administrator,Maintain parameters entity data for data management (Extension),,,,
DATAMANAGEMENTADMINISTRATOR,Data management administrator,View parameters entity data for data management (Extension),,,,
DATAMANAGEMENTADMINISTRATOR,Data management administrator,Maintain reference entity data for data management (Extension),,,,
DATAMANAGEMENTADMINISTRATOR,Data management administrator,View reference entity data for data management (Extension),,,,
DATAMANAGEMENTADMINISTRATOR,Data management administrator,Maintain engineering change management entities,,,,
DATAMANAGEMENTADMINISTRATOR,Data management administrator,View engineering change management entities,,,,
DATAMANAGEMENTADMINISTRATOR,Data management administrator,Maintain Asset management document entity data for data management,,,,
DATAMANAGEMENTADMINISTRATOR,Data management administrator,View Asset management document entity data for data management,,,,
DATAMANAGEMENTADMINISTRATOR,Data management administrator,Maintain Asset management master entity data for data management,,,,
DATAMANAGEMENTADMINISTRATOR,Data management administrator,View Asset management master entity data for data management,,,,
DATAMANAGEMENTADMINISTRATOR,Data management administrator,Maintain Asset management parameters entity data for data management,,,,
DATAMANAGEMENTADMINISTRATOR,Data management administrator,View Asset management parameters entity data for data management,,,,
DATAMANAGEMENTADMINISTRATOR,Data management administrator,Maintain Asset management reference entity data for data management,,,,
DATAMANAGEMENTADMINISTRATOR,Data management administrator,View Asset management reference entity data for data management,,,,
DATAMANAGEMENTADMINISTRATOR,Data management administrator,Maintain Parameters entity data for data management,,,,
DATAMANAGEMENTADMINISTRATOR,Data management administrator,View Transaction entity data for data management,,,,
DATAMANAGEMENTADMINISTRATOR,Data management administrator,Maintain Transaction entity data for data management,,,,
DATAMANAGEMENTADMINISTRATOR,Data management administrator,View Parameters entity data for data management,,,,
DATAMANAGEMENTADMINISTRATOR,Data management administrator,Maintain data import export operation processes,,,,
DATAMANAGEMENTADMINISTRATOR,Data management administrator,View data import export operation processes,,,,
DATAMANAGEMENTMIGRATIONUSER,Data management migration user,Maintain Configuration entity data in foundation for data management,,,,
DATAMANAGEMENTMIGRATIONUSER,Data management migration user,View Configuration entity data in foundation for data management,,,,
DATAMANAGEMENTMIGRATIONUSER,Data management migration user,Maintain Master entity data in foundation for data management,,,,
DATAMANAGEMENTMIGRATIONUSER,Data management migration user,View Master entity data in foundation for data management,,,,
DATAMANAGEMENTMIGRATIONUSER,Data management migration user,Parameters,,,,
DATAMANAGEMENTMIGRATIONUSER,Data management migration user,View Parameters entity data in foundation for data management,,,,
DATAMANAGEMENTMIGRATIONUSER,Data management migration user,Maintain Reference entity data in foundation for data management,,,,
DATAMANAGEMENTMIGRATIONUSER,Data management migration user,View Reference entity data in foundation for data management,,,,
DATAMANAGEMENTMIGRATIONUSER,Data management migration user,Maintain Mixed Reality master entity data for data management,,,,
DATAMANAGEMENTMIGRATIONUSER,Data management migration user,View Mixed Reality master entity data for data management,,,,
DATAMANAGEMENTMIGRATIONUSER,Data management migration user,Maintain and configure team-related entities.,,,,
DATAMANAGEMENTMIGRATIONUSER,Data management migration user,View team-related entities.,,,,
DATAMANAGEMENTMIGRATIONUSER,Data management migration user,View fiscal calendar entities duty.,,,,
DATAMANAGEMENTMIGRATIONUSER,Data management migration user,Maintain fiscal calendar entities duty.,,,,
DATAMANAGEMENTMIGRATIONUSER,Data management migration user,Maintain currency entities master,,,,
DATAMANAGEMENTMIGRATIONUSER,Data management migration user,View currency entities master,,,,
DATAMANAGEMENTMIGRATIONUSER,Data management migration user,Maintain Master entity data for data management,,,,
DATAMANAGEMENTMIGRATIONUSER,Data management migration user,View Master entity data for data management,,,,
DATAMANAGEMENTMIGRATIONUSER,Data management migration user,Maintain Reference entity data for data management,,,,
DATAMANAGEMENTMIGRATIONUSER,Data management migration user,View Reference entity data for data management,,,,
DATAMANAGEMENTMIGRATIONUSER,Data management migration user,Maintain ledger entities master,,,,
DATAMANAGEMENTMIGRATIONUSER,Data management migration user,View ledger entities master,,,,
DATAMANAGEMENTMIGRATIONUSER,Data management migration user,Maintain Case Management document entity data for data management,,,,
DATAMANAGEMENTMIGRATIONUSER,Data management migration user,View Case Management document entity data for data management,,,,
DATAMANAGEMENTMIGRATIONUSER,Data management migration user,Maintain Case Management document entity data for data management,,,,
DATAMANAGEMENTMIGRATIONUSER,Data management migration user,View Case Management document entity data for data management,,,,
DATAMANAGEMENTMIGRATIONUSER,Data management migration user,Maintain Document entity data for data management,,,,
DATAMANAGEMENTMIGRATIONUSER,Data management migration user,View Document entity data for data management,,,,
DATAMANAGEMENTMIGRATIONUSER,Data management migration user,Maintain Master entity data for data management,,,,
DATAMANAGEMENTMIGRATIONUSER,Data management migration user,View Master entity data for data management,,,,
DATAMANAGEMENTMIGRATIONUSER,Data management migration user,Maintain Parameters entity data for data management,,,,
DATAMANAGEMENTMIGRATIONUSER,Data management migration user,View Parameters entity data for data management,,,,
DATAMANAGEMENTMIGRATIONUSER,Data management migration user,Maintain Reference entity data for data management,,,,
DATAMANAGEMENTMIGRATIONUSER,Data management migration user,View Reference entity data for data management,,,,
DATAMANAGEMENTMIGRATIONUSER,Data management migration user,Maintain Transaction entity data for data management,,,,
DATAMANAGEMENTMIGRATIONUSER,Data management migration user,View Transaction entity data for data management,,,,
DATAMANAGEMENTMIGRATIONUSER,Data management migration user,Maintain sensitive information for Bank accounts entity,,,,
DATAMANAGEMENTMIGRATIONUSER,Data management migration user,Maintain sensitive bank account information for company accounts,,,,
DATAMANAGEMENTMIGRATIONUSER,Data management migration user,Maintain sensitive information for Bank positive pay transactions entity,,,,
DATAMANAGEMENTMIGRATIONUSER,Data management migration user,Maintain Document entity data for data management,,,,
DATAMANAGEMENTMIGRATIONUSER,Data management migration user,View Document entity data for data management,,,,
DATAMANAGEMENTMIGRATIONUSER,Data management migration user,Maintain Master entity data for data management,,,,
DATAMANAGEMENTMIGRATIONUSER,Data management migration user,View Master entity data for data management,,,,
DATAMANAGEMENTMIGRATIONUSER,Data management migration user,Maintain Parameters entity data for data management,,,,
DATAMANAGEMENTMIGRATIONUSER,Data management migration user,View Parameters entity data for data management,,,,
DATAMANAGEMENTMIGRATIONUSER,Data management migration user,Maintain Reference entity data for data management,,,,
DATAMANAGEMENTMIGRATIONUSER,Data management migration user,View Reference entity data for data management,,,,
DATAMANAGEMENTMIGRATIONUSER,Data management migration user,Maintain Transaction entity data for data management,,,,
DATAMANAGEMENTMIGRATIONUSER,Data management migration user,View Transaction entity data for data management,,,,
DATAMANAGEMENTMIGRATIONUSER,Data management migration user,PayrollPositivePayExportStagingTPFMaintain,,,,
DATAMANAGEMENTMIGRATIONUSER,Data management migration user,Maintain Configuration entity data for data management,,,,
DATAMANAGEMENTMIGRATIONUSER,Data management migration user,View Configuration entity data for data management,,,,
DATAMANAGEMENTMIGRATIONUSER,Data management migration user,Maintain financial reporting entity data for data management,,,,
DATAMANAGEMENTMIGRATIONUSER,Data management migration user,View financial reporting entity data for data management,,,,
DATAMANAGEMENTMIGRATIONUSER,Data management migration user,Maintain BOM master through services,,,,
DATAMANAGEMENTMIGRATIONUSER,Data management migration user,Inquire into BOM master through services,,,,
DATAMANAGEMENTMIGRATIONUSER,Data management migration user,Maintain route master through services,,,,
DATAMANAGEMENTMIGRATIONUSER,Data management migration user,Inquire into route master through services,,,,
DATAMANAGEMENTMIGRATIONUSER,Data management migration user,Maintain configuration entity data for data management (Extension),,,,
DATAMANAGEMENTMIGRATIONUSER,Data management migration user,View configuration entity data for data management (Extension),,,,
DATAMANAGEMENTMIGRATIONUSER,Data management migration user,Maintain document entity data for data management (Extension),,,,
DATAMANAGEMENTMIGRATIONUSER,Data management migration user,View document entity data for data management (Extension),,,,
DATAMANAGEMENTMIGRATIONUSER,Data management migration user,Maintain master entity data for data management (Extension),,,,
DATAMANAGEMENTMIGRATIONUSER,Data management migration user,View master entity data for data management (Extension),,,,
DATAMANAGEMENTMIGRATIONUSER,Data management migration user,Maintain parameters entity data for data management (Extension),,,,
DATAMANAGEMENTMIGRATIONUSER,Data management migration user,View parameters entity data for data management (Extension),,,,
DATAMANAGEMENTMIGRATIONUSER,Data management migration user,Maintain reference entity data for data management (Extension),,,,
DATAMANAGEMENTMIGRATIONUSER,Data management migration user,View reference entity data for data management (Extension),,,,
DATAMANAGEMENTMIGRATIONUSER,Data management migration user,Maintain engineering change management entities,,,,
